{
  "scenarioId": "default",
  "name": "Sound Wave Explorer",
  "description": "Freely adjust the frequency and amplitude of a point sound source. Observe how the spherical wave propagates; higher frequency produces denser wave arcs (shorter wavelength).",
  "version": "1.0",
  "screen": "singleSource",
  "initialParams": {
    "frequency": 500,
    "amplitude": 0.5
  },
  "paramRanges": {
    "frequency": { "min": 0, "max": 1000, "step": 10, "unit": "Hz" },
    "amplitude": { "min": 0, "max": 1, "step": 0.05, "unit": null }
  },
  "successCriteria": [
    {"id": "sc-1", "type": "observeWavelength", "description": "Notice that increasing frequency makes the wave arcs denser", "params": {"minFrequency": 700}},
    {"id": "sc-2", "type": "observeAmplitude", "description": "Notice that amplitude controls the brightness of the wave pattern", "params": {"minAmplitude": 0.3}}
  ],
  "hints": [
    {"trigger": "always", "message": "Drag the Frequency slider to see wavelength change in real time"},
    {"trigger": "always", "message": "Higher frequency = shorter wavelength (denser arcs). Lower frequency = longer wavelength (sparser arcs)."}
  ],
  "inquiryTask": {
    "question": "改变声音的频率，观察球面波的疏密变化，频率与波长有什么关系？",
    "steps": [
      {
        "id": "step-1",
        "instruction": "把频率调到 200Hz，观察波弧的疏密并点击「记录本次实验」。",
        "hint": "注意左上角信息卡的波长数值"
      },
      {
        "id": "step-2",
        "instruction": "把频率调到 600Hz、1000Hz，各记录一次。",
        "hint": "对比不同频率下的波长"
      },
      {
        "id": "step-3",
        "instruction": "归纳：频率增大时波长如何变化？"
      }
    ],
    "referenceConclusion": "频率与波长成反比：λ = v / f。频率越高，波长越短，波弧越密；频率越低，波长越长，波弧越疏。",
    "snapshotColumns": [
      { "key": "frequency", "label": "频率(Hz)", "source": "param" },
      { "key": "amplitude", "label": "振幅", "source": "param" },
      { "key": "wavelength", "label": "波长(m)", "source": "reading" }
    ]
  }
}